{
  "$schema": "https://json-schema.org/draft/2020-12/schema",
  "$id": "https://echoforge.local/schemas/dataset_card.schema.json",
  "title": "dataset_card",
  "description": "EchoForge dataset_card document. Declares a named dataset assembled from one or more source RCS campaigns, with train/validation/test split counts. Conforms to the EchoForge strict-open contract: deterministic ids, explicit provenance, license, and validation envelope.",
  "type": "object",
  "additionalProperties": false,
  "required": [
    "id",
    "kind",
    "schema_version",
    "public_proxy_id",
    "provenance",
    "license",
    "validation",
    "dataset_name",
    "source_campaign_ids",
    "splits"
  ],
  "properties": {
    "id": {
      "description": "Deterministic EchoForge id of the form ef:<kind>:<public_proxy_id>:<16hex>:1, computed from the identity field tuple.",
      "$ref": "https://echoforge.local/schemas/common.schema.json#/$defs/deterministic_id"
    },
    "kind": {
      "description": "Document kind discriminator; must be the literal string \"dataset_card\".",
      "const": "dataset_card"
    },
    "schema_version": {
      "description": "Schema contract version this document conforms to (currently pinned to 1.0.0).",
      "$ref": "https://echoforge.local/schemas/common.schema.json#/$defs/schema_version"
    },
    "public_proxy_id": {
      "description": "Slug identifying the public proxy this dataset is derived from (lowercase, dot/underscore/hyphen separated).",
      "$ref": "https://echoforge.local/schemas/common.schema.json#/$defs/slug"
    },
    "provenance": {
      "description": "Provenance envelope: source kind, source references, generator, timestamp, and payload fingerprint.",
      "$ref": "https://echoforge.local/schemas/common.schema.json#/$defs/provenance"
    },
    "license": {
      "description": "License envelope (SPDX id and optional notice) governing use of this document.",
      "$ref": "https://echoforge.local/schemas/common.schema.json#/$defs/license"
    },
    "validation": {
      "description": "Validation envelope: tier, overall status, uncertainty score, and per-check results.",
      "$ref": "https://echoforge.local/schemas/common.schema.json#/$defs/validation"
    },
    "dataset_name": {
      "description": "Human-readable name of the dataset (e.g. \"xband_vehicles_v1\"); non-empty string.",
      "type": "string",
      "minLength": 1
    },
    "source_campaign_ids": {
      "description": "Deterministic ids of the rcs_campaign documents that contributed samples to this dataset; at least one entry required.",
      "type": "array",
      "minItems": 1,
      "items": {
        "$ref": "https://echoforge.local/schemas/common.schema.json#/$defs/deterministic_id"
      }
    },
    "splits": {
      "description": "Sample counts per dataset split (train / validation / test); each count is a non-negative integer (number of samples).",
      "type": "object",
      "additionalProperties": false,
      "required": ["train", "validation", "test"],
      "properties": {
        "train": {
          "description": "Number of samples in the training split; non-negative integer.",
          "type": "integer",
          "minimum": 0
        },
        "validation": {
          "description": "Number of samples in the validation split; non-negative integer.",
          "type": "integer",
          "minimum": 0
        },
        "test": {
          "description": "Number of samples in the test split; non-negative integer.",
          "type": "integer",
          "minimum": 0
        }
      }
    }
  }
}
